{
  "gaps": [],
  "handoff_id": "HANDOFF-SYNTH-DATAGOVOPS-001",
  "handoff_sha256": "3af962175b40be269ccc8de83ba2768253bbdc8da4526c90c22f00cec9c8c2a7",
  "integration_position": "verified",
  "non_claims": {
    "artifact_safety_established": false,
    "consumer_acceptance_established": false,
    "cross_system_identity_established": false,
    "delivery_established": false,
    "payload_schema_conformance_established": false,
    "payload_truth_established": false,
    "peer_contract_semantic_compatibility_established": false,
    "peer_repository_authenticity_established": false,
    "producer_authority_established": false,
    "production_interoperability_established": false,
    "regulatory_compliance_established": false
  },
  "payload_digest_valid": true,
  "peer_contract_blob_valid": true,
  "profile": "datagovops-control-evidence",
  "profile_binding_valid": true,
  "schema_version": "vulnevidenceops.integration-verification.v1",
  "temporal_state": "current",
  "verified_at": "2026-01-20T00:15:00Z"
}
