{
  "gaps": [],
  "handoff_id": "HANDOFF-SYNTH-DORAOPS-001",
  "handoff_sha256": "a59be2be5569c80a5330f0ca047a53a16fd73d41707c5dc53a55fdecc71e4435",
  "integration_position": "verified",
  "non_claims": {
    "artifact_safety_established": false,
    "consumer_acceptance_established": false,
    "cross_system_identity_established": false,
    "delivery_established": false,
    "payload_schema_conformance_established": false,
    "payload_truth_established": false,
    "peer_contract_semantic_compatibility_established": false,
    "peer_repository_authenticity_established": false,
    "producer_authority_established": false,
    "production_interoperability_established": false,
    "regulatory_compliance_established": false
  },
  "payload_digest_valid": true,
  "peer_contract_blob_valid": true,
  "profile": "doraops-operational-control-evidence",
  "profile_binding_valid": true,
  "schema_version": "vulnevidenceops.integration-verification.v1",
  "temporal_state": "current",
  "verified_at": "2026-01-20T00:15:00Z"
}
